{
  "$schema": "https://json-schema.org/draft/2020-12/schema",
  "$id": "https://example.invalid/anqian-dongcha-baogao-v2/研究项目.schema.json",
  "title": "行业调研分析研究项目",
  "type": "object",
  "additionalProperties": false,
  "required": ["schema_version","project","questions","sources","evidence","calculations","hypotheses","mechanisms","literature_comparisons","points_of_view","storyline","attachments"],
  "properties": {"schema_version":{"type":"string","const":"0.1"},"project":{"$ref":"#/$defs/project"},"questions":{"type":"array","items":{"$ref":"#/$defs/question"}},"sources":{"type":"array","items":{"$ref":"#/$defs/source"}},"evidence":{"type":"array","items":{"$ref":"#/$defs/evidence"}},"calculations":{"type":"array","items":{"$ref":"#/$defs/calculation"}},"hypotheses":{"type":"array","items":{"$ref":"#/$defs/hypothesis"}},"mechanisms":{"type":"array","items":{"$ref":"#/$defs/mechanism"}},"literature_comparisons":{"type":"array","items":{"$ref":"#/$defs/literatureComparison"}},"points_of_view":{"type":"array","items":{"$ref":"#/$defs/pointOfView"}},"storyline":{"type":"array","items":{"$ref":"#/$defs/storylinePage"}},"attachments":{"type":"array","items":{"$ref":"#/$defs/attachment"}}},
  "$defs": {
    "nonEmptyString": {"type":"string","minLength":1},
    "id": {"type":"string","pattern":"^[A-Za-z0-9][A-Za-z0-9._-]*$"},
    "stringList": {"type":"array","items":{"$ref":"#/$defs/nonEmptyString"}},
    "project": {"type":"object","additionalProperties":false,"required":["project_id","name","version","status","report_modes"],"properties":{"project_id":{"$ref":"#/$defs/id"},"name":{"$ref":"#/$defs/nonEmptyString"},"version":{"$ref":"#/$defs/nonEmptyString"},"status":{"type":"string","enum":["internal_draft","client_discussion","formal_delivery"]},"report_modes":{"type":"array","minItems":1,"items":{"type":"string","enum":["consulting_deck","long_report","survey_report","research_report"]},"uniqueItems":true}}},
    "question": {"type":"object","additionalProperties":false,"required":["question_id","business_meaning","scope","status"],"properties":{"question_id":{"$ref":"#/$defs/id"},"business_meaning":{"$ref":"#/$defs/nonEmptyString"},"scope":{"$ref":"#/$defs/nonEmptyString"},"status":{"type":"string","enum":["open","in_progress","answered","out_of_scope"]}}},
    "source": {"type":"object","additionalProperties":false,"required":["source_id","title","publisher_or_author","original_url_or_file","publication_date","collection_date","data_period","scope","access_method","share_restriction"],"properties":{"source_id":{"$ref":"#/$defs/id"},"title":{"$ref":"#/$defs/nonEmptyString"},"publisher_or_author":{"$ref":"#/$defs/nonEmptyString"},"original_url_or_file":{"$ref":"#/$defs/nonEmptyString"},"publication_date":{"$ref":"#/$defs/nonEmptyString"},"collection_date":{"$ref":"#/$defs/nonEmptyString"},"data_period":{"$ref":"#/$defs/nonEmptyString"},"scope":{"$ref":"#/$defs/nonEmptyString"},"access_method":{"$ref":"#/$defs/nonEmptyString"},"share_restriction":{"$ref":"#/$defs/nonEmptyString"},"original_location":{"type":"string"},"source_kind":{"type":"string","enum":["original","search_summary","client_statement"]}}},
    "evidenceBase": {"type":"object","required":["evidence_id","question_ids","source_id","evidence_type","claim","limitations","review_status","claim_type"],"properties":{"evidence_id":{"$ref":"#/$defs/id"},"question_ids":{"type":"array","minItems":1,"items":{"$ref":"#/$defs/id"},"uniqueItems":true},"source_id":{"$ref":"#/$defs/id"},"evidence_type":{"$ref":"#/$defs/nonEmptyString"},"claim":{"$ref":"#/$defs/nonEmptyString"},"limitations":{"$ref":"#/$defs/nonEmptyString"},"review_status":{"type":"string","enum":["unreviewed","reviewed","restricted","rejected"]},"claim_type":{"$ref":"#/$defs/claimType"},"original_location":{"$ref":"#/$defs/nonEmptyString"},"value":{"type":"number"},"unit":{"$ref":"#/$defs/nonEmptyString"},"analysis_level":{"$ref":"#/$defs/nonEmptyString"}}},
    "evidence": {"unevaluatedProperties":false,"oneOf":[{"allOf":[{"$ref":"#/$defs/evidenceBase"},{"type":"object","required":["evidence_type","sample_size","population","method","survey_period","question_wording","response_mode","weighting","error_information"],"properties":{"evidence_type":{"const":"consumer_survey"},"sample_size":{"type":"integer","minimum":1},"population":{"$ref":"#/$defs/nonEmptyString"},"method":{"$ref":"#/$defs/nonEmptyString"},"survey_period":{"$ref":"#/$defs/nonEmptyString"},"question_wording":{"$ref":"#/$defs/nonEmptyString"},"response_mode":{"type":"string","enum":["single","multiple","open"]},"weighting":{"$ref":"#/$defs/nonEmptyString"},"error_information":{"$ref":"#/$defs/nonEmptyString"},"denominator":{"$ref":"#/$defs/nonEmptyString"},"denominator_count":{"type":"integer","minimum":1}}}]},{"allOf":[{"$ref":"#/$defs/evidenceBase"},{"type":"object","required":["evidence_type","brand","product","merchant","specification","observed_price","currency","promotion_eligibility","region","stock_status","observed_at","entry_point","quantity","shipping"],"properties":{"evidence_type":{"const":"product_observation"},"brand":{"$ref":"#/$defs/nonEmptyString"},"product":{"$ref":"#/$defs/nonEmptyString"},"merchant":{"$ref":"#/$defs/nonEmptyString"},"specification":{"$ref":"#/$defs/nonEmptyString"},"observed_price":{"type":"number","minimum":0},"currency":{"$ref":"#/$defs/nonEmptyString"},"promotion_eligibility":{"$ref":"#/$defs/nonEmptyString"},"region":{"$ref":"#/$defs/nonEmptyString"},"stock_status":{"$ref":"#/$defs/nonEmptyString"},"observed_at":{"$ref":"#/$defs/nonEmptyString"},"entry_point":{"$ref":"#/$defs/nonEmptyString"},"quantity":{"type":"integer","minimum":1},"shipping":{"$ref":"#/$defs/nonEmptyString"}}}]},{"allOf":[{"$ref":"#/$defs/evidenceBase"},{"type":"object","required":["evidence_type","publisher","self_reported","document_title","report_period","definition_scope","original_location"],"properties":{"evidence_type":{"enum":["company_disclosure","public_document"]},"publisher":{"$ref":"#/$defs/nonEmptyString"},"self_reported":{"type":"boolean"},"document_title":{"$ref":"#/$defs/nonEmptyString"},"report_period":{"$ref":"#/$defs/nonEmptyString"},"definition_scope":{"$ref":"#/$defs/nonEmptyString"},"original_location":{"$ref":"#/$defs/nonEmptyString"}}}]},{"allOf":[{"$ref":"#/$defs/evidenceBase"},{"type":"object","required":["evidence_type","statistical_agency","definition","population","geography","period","unit","denominator","method"],"properties":{"evidence_type":{"const":"industry_statistic"},"statistical_agency":{"$ref":"#/$defs/nonEmptyString"},"definition":{"$ref":"#/$defs/nonEmptyString"},"population":{"$ref":"#/$defs/nonEmptyString"},"geography":{"$ref":"#/$defs/nonEmptyString"},"period":{"$ref":"#/$defs/nonEmptyString"},"unit":{"$ref":"#/$defs/nonEmptyString"},"denominator":{"$ref":"#/$defs/nonEmptyString"},"method":{"$ref":"#/$defs/nonEmptyString"}}}]},{"allOf":[{"$ref":"#/$defs/evidenceBase"},{"type":"object","required":["evidence_type","participant_role","participant_count_or_selection","interview_date","record_location","anonymity","excerpt_or_observation"],"properties":{"evidence_type":{"const":"qualitative_interview"},"participant_role":{"$ref":"#/$defs/nonEmptyString"},"participant_count_or_selection":{"$ref":"#/$defs/nonEmptyString"},"interview_date":{"$ref":"#/$defs/nonEmptyString"},"record_location":{"$ref":"#/$defs/nonEmptyString"},"anonymity":{"$ref":"#/$defs/nonEmptyString"},"excerpt_or_observation":{"$ref":"#/$defs/nonEmptyString"}}}]},{"allOf":[{"$ref":"#/$defs/evidenceBase"},{"type":"object","required":["evidence_type","input_evidence_ids","formula","conversions","assumptions","unit","rounding","comparison_conditions"],"properties":{"evidence_type":{"const":"derived_calculation"},"input_evidence_ids":{"type":"array","minItems":1,"items":{"$ref":"#/$defs/id"},"uniqueItems":true},"formula":{"$ref":"#/$defs/nonEmptyString"},"conversions":{"$ref":"#/$defs/nonEmptyString"},"assumptions":{"$ref":"#/$defs/nonEmptyString"},"unit":{"$ref":"#/$defs/nonEmptyString"},"rounding":{"$ref":"#/$defs/nonEmptyString"},"comparison_conditions":{"$ref":"#/$defs/nonEmptyString"}}}]}]},
    "calculation": {"type":"object","additionalProperties":false,"required":["calculation_id","input_evidence_ids","formula","assumptions","unit","rounding","conversions","comparison_conditions"],"properties":{"calculation_id":{"$ref":"#/$defs/id"},"input_evidence_ids":{"type":"array","minItems":1,"items":{"$ref":"#/$defs/id"},"uniqueItems":true},"formula":{"$ref":"#/$defs/nonEmptyString"},"assumptions":{"$ref":"#/$defs/nonEmptyString"},"unit":{"$ref":"#/$defs/nonEmptyString"},"rounding":{"$ref":"#/$defs/nonEmptyString"},"conversions":{"$ref":"#/$defs/nonEmptyString"},"comparison_conditions":{"$ref":"#/$defs/nonEmptyString"},"result":{"type":"number"},"review_status":{"type":"string","enum":["unreviewed","reviewed","restricted","rejected"]}}},
    "hypothesis": {"type":"object","additionalProperties":false,"required":["hypothesis_id","statement","falsifier","question_ids","supporting_evidence_ids","counter_evidence_ids","competing_mechanism_ids","next_discriminating_evidence","status"],"properties":{"hypothesis_id":{"$ref":"#/$defs/id"},"statement":{"$ref":"#/$defs/nonEmptyString"},"falsifier":{"$ref":"#/$defs/nonEmptyString"},"question_ids":{"$ref":"#/$defs/stringList"},"supporting_evidence_ids":{"$ref":"#/$defs/stringList"},"counter_evidence_ids":{"$ref":"#/$defs/stringList"},"competing_mechanism_ids":{"$ref":"#/$defs/stringList"},"next_discriminating_evidence":{"$ref":"#/$defs/nonEmptyString"},"status":{"type":"string","enum":["draft","evidence_indistinguishable","ready_for_review","client_ready"]},"analysis_level":{"$ref":"#/$defs/nonEmptyString"},"content_review":{"$ref":"#/$defs/contentReview"}}},
    "mechanism": {"type":"object","additionalProperties":false,"required":["mechanism_id","name","object","derivation","supporting_evidence_ids","alternative_explanations","boundaries","client_implication"],"properties":{"mechanism_id":{"$ref":"#/$defs/id"},"name":{"$ref":"#/$defs/nonEmptyString"},"object":{"$ref":"#/$defs/nonEmptyString"},"derivation":{"$ref":"#/$defs/nonEmptyString"},"supporting_evidence_ids":{"$ref":"#/$defs/stringList"},"alternative_explanations":{"$ref":"#/$defs/stringList"},"boundaries":{"$ref":"#/$defs/nonEmptyString"},"client_implication":{"$ref":"#/$defs/nonEmptyString"},"analysis_level":{"$ref":"#/$defs/nonEmptyString"},"content_review":{"$ref":"#/$defs/contentReview"}}},
    "literatureComparison": {"type":"object","additionalProperties":false,"required":["literature_id","framework","source_id","relation","comparison_level","limitations"],"properties":{"literature_id":{"$ref":"#/$defs/id"},"framework":{"$ref":"#/$defs/nonEmptyString"},"source_id":{"$ref":"#/$defs/id"},"relation":{"type":"string","enum":["confirm","revise","missing_dimension","not_comparable"]},"comparison_level":{"$ref":"#/$defs/nonEmptyString"},"limitations":{"$ref":"#/$defs/nonEmptyString"},"evidence_ids":{"$ref":"#/$defs/stringList"},"source_level":{"$ref":"#/$defs/nonEmptyString"},"current_level":{"$ref":"#/$defs/nonEmptyString"},"level_difference":{"$ref":"#/$defs/nonEmptyString"},"discrimination":{"$ref":"#/$defs/nonEmptyString"}}},
    "pointOfView": {"type":"object","additionalProperties":false,"required":["pov_id","judgment","question_ids","evidence_ids","derivation","alternative_explanations","boundaries","business_implication","discussion_action","status","claim_type"],"properties":{"pov_id":{"$ref":"#/$defs/id"},"judgment":{"$ref":"#/$defs/nonEmptyString"},"question_ids":{"$ref":"#/$defs/stringList"},"evidence_ids":{"$ref":"#/$defs/stringList"},"derivation":{"$ref":"#/$defs/nonEmptyString"},"alternative_explanations":{"$ref":"#/$defs/stringList"},"boundaries":{"$ref":"#/$defs/nonEmptyString"},"business_implication":{"$ref":"#/$defs/nonEmptyString"},"discussion_action":{"$ref":"#/$defs/nonEmptyString"},"status":{"type":"string","enum":["draft","internal_review","client_ready"]},"claim_type":{"$ref":"#/$defs/claimType"},"analysis_level":{"$ref":"#/$defs/nonEmptyString"},"content_review":{"$ref":"#/$defs/contentReview"},"hypothesis_ids":{"$ref":"#/$defs/stringList"},"mechanism_ids":{"$ref":"#/$defs/stringList"}}},
    "storylinePage": {"type":"object","additionalProperties":false,"required":["page_id","title","point_of_view_id","evidence_ids","visual_task","business_meaning","speaker_notes","source_ids","limitations","page_status"],"properties":{"page_id":{"$ref":"#/$defs/id"},"title":{"$ref":"#/$defs/nonEmptyString"},"point_of_view_id":{"$ref":"#/$defs/id"},"evidence_ids":{"$ref":"#/$defs/stringList"},"visual_task":{"$ref":"#/$defs/nonEmptyString"},"business_meaning":{"$ref":"#/$defs/nonEmptyString"},"speaker_notes":{"$ref":"#/$defs/nonEmptyString"},"source_ids":{"$ref":"#/$defs/stringList"},"limitations":{"$ref":"#/$defs/nonEmptyString"},"page_status":{"type":"string","enum":["research_stage","client_discussion","formal_delivery"]},"claim_type":{"$ref":"#/$defs/claimType"},"content_review":{"$ref":"#/$defs/contentReview"}}},
    "attachment": {"type":"object","additionalProperties":false,"required":["attachment_id","file_name","file_path","share_approved","share_basis","page_count","cited_pages","format_label"],"properties":{"attachment_id":{"$ref":"#/$defs/id"},"file_name":{"$ref":"#/$defs/nonEmptyString"},"file_path":{"$ref":"#/$defs/nonEmptyString"},"share_approved":{"type":"boolean"},"share_basis":{"$ref":"#/$defs/nonEmptyString"},"page_count":{"type":"integer","minimum":0},"cited_pages":{"type":"array","items":{"type":"integer","minimum":1},"uniqueItems":true},"format_label":{"$ref":"#/$defs/nonEmptyString"}}},
    "claimType": {"type":"string","enum":["fact","judgment","hypothesis","recommendation","client_statement"]},
    "contentReview": {"type":"object","additionalProperties":false,"required":["status","reviewer","basis"],"properties":{"status":{"type":"string","enum":["unreviewed","reviewed","rejected"]},"reviewer":{"$ref":"#/$defs/nonEmptyString"},"basis":{"$ref":"#/$defs/nonEmptyString"}}}
  }
}
